Name,author,Repo,type,thumb,description,maturity,Home,language,license,Contacted?,Note,JekyllContent,Filename,Screenshot,Removed,Room
mautrix-appservice-go,Tulir,https://github.com/tulir/mautrix-appservice-go,as,,An application service framework written in Go,Alpha,,Go,MIT,,,mautrix-appservice-go is an application service framework written in Go.,2017-06-27-mautrix-appservice-go.md,,,
Maunium GitLab Bot,Tulir,https://github.com/maubot/gitlab,bot,,A GitLab bot for Matrix,Alpha,,Go,AGPL3,,,"Maunium GitLab Bot is a bot written in Go.
It allows you to interact with GitLab from Matrix and receive notifications
from GitLab webhooks (issues, merge requests, pushes, etc..).

You can use the publicly hosted instance on [t2bot.io](https://t2bot.io/gitlab),
or check out the project on [GitHub]({{ page.repo }})",2017-09-29-maulabbot.md,,,
mautrix-telegram,Tulir,https://github.com/tulir/mautrix-telegram,as,,A Matrix-Telegram hybrid puppeting/relaybot bridge,Beta,,Python,AGPL3,,,A Matrix-Telegram hybrid puppeting/relaybot bridge. Written in Python using [Telethon](https://github.com/LonamiWebs/Telethon).,2017-11-28-mautrix-telegram.md,/docs/projects/images/mautrix-telegram.png,,
gomuks,Tulir,https://github.com/tulir/gomuks,client,/docs/projects/images/gomuks-thumbnail.png,A terminal Matrix client written in Go,Alpha,,Go,GPL3,"Yes, Tulir",,gomuks is a terminal-based Matrix client written in Go with [gomatrix](https://github.com/matrix-org/gomatrix) and [tview](https://github.com/rivo/tview).,2018-03-15-gomuks.md,/docs/projects/images/gomuks.png,,
godot-matrix,vurpo,,sdk,,Godot Engine module for Matrix client,Alpha,,,,,,"Module for [Godot Engine](https://godotengine.org) that lets you easily integrate a Matrix client into a game developed using Godot (for example for in-game chat, matchmaking, lobbies, or something else entirely). [Source](https://gitlab.com/vurpo/godot-matrix)",2017-09-13-godot-matrix.md,,,
Koma,wilpeters,https://github.com/koma-im/koma,client,/docs/projects/images/koma-preview-thumbnail.png,A modern client designed to launch fast and help you find information in large amounts of messages,Alpha,,Kotlin,GPL3,,,"An instant messaging application written specifically for the matrix protocol to take advantage of its modern features. Designed to be lightweight but not dependent on fast Internet: the state is stored locally so you don't have to wait every time you open it. Highly versatile notification options keep you informed without getting distracted.
While it's still in early stages and far from feature-complete, the chat window has taken shape, feel free to try it out and give us feedback and feature requests.
The project is hosted on [github](https://github.com/koma-im/koma).",2017-06-20-koma-im.md,/docs/projects/images/koma-preview.png,,
Ruma,Jimmy Cuadra,,server,,Ruma is a server written in Rust.,Alpha,,Rust,,,,Ruma is a server written in Rust ([github](https://github.com/ruma/ruma)),2015-11-29-ruma.md,,,
Perpetually Talking Online (PTO),tdfischer,https://github.com/tdfischer/pto,client,,PTO is an IRC frontend to the federated Matrix network.,No longer maintained,,Rust,Apache,,,"Perpetually Talking Online (PTO) is an IRC frontend to the federated Matrix network. It aims to enable as many people as possible to use an existing Matrix homeserver with their existing IRC clients, and provides a radically expanded feature set for existing IRC communities looking to migrate to Matrix.

See [pto.im](http://pto.im) for more info - or grab the code from [GitHub](https://github.com/tdfischer/pto).

Unfortunately, it appears that this project is no longer being worked on. Check out [matrix-ircd](./matrix-ircd.html) instead!",2015-12-10-pto.md,,,
matrix-appservice-sms,eeeeeta,https://github.com/eeeeeta/matrix-appservice-sms,as,,Single-user Matrix.org Application Service (AS) to bridge SMSes to the Matrix network!,Alpha,,Rust,GPL3,,,"This is a Matrix.org Application Service (AS) that bridges SMS messages to Matrix, using a USB 3G modem plugged into a server. Crucially, it only works for one user - obviously, if you only have one 3G modem, it doesn't really make sense to support more than one user...",2018-04-24-matrix-appservice-sms.md,,,
matrix-monitor-bot,Travis Ralston,https://github.com/turt2live/matrix-monitor-bot,bot,,A bot to measure latency between homeservers.,Alpha,,Go,Apache,,,"#monitorbot:t2bot.io is a bot to measure latency between homeservers (as perceived by users).

It’s able to report metrics to Prometheus and has it’s own built-in dashboard (see <https://lag.t2bot.io/> for some horrendous times). In the coming weeks it’ll become more production-ready, however in the meantime if people are looking to help iron out the scalability issues, please run an instance on your homeserver.",2018-04-24-matrix-monitor-bot.md,,,
uMatriks,uMatriks team,https://github.com/uMatriks/uMatriks,client,,uMatriks is a native matrix client being developed for Ubuntu Touch,Beta,,C++/Qt/QML,GPL3,,,"uMatriks is a native matrix client being developed for Ubuntu Touch.

Built on libqmatrixclient.",2018-04-24-uMatriks.md,,,
matrix-puppet-maxs,,https://github.com/tfreedman/matrix-puppet-maxs,,,,,,,,,,,,,,
matrix-register-bot,,https://github.com/krombel/matrix-register-bot,,,,,,,,,,,,,,
picard,Cadair and SolarDrew,https://github.com/SolarDrew/skill-picard,other,,Tools for handling slack channels and converting them to matrix,Alpha,,Python,,,,"This opsdroid skill enables the bridging of a slack team to a matrix communtiy. It uses the
[slack appservice](https://github.com/matrix-org/matrix-appservice-slack) to
bridge individual rooms, but it monitors slack for new channels and creates
rooms on matrix for these new channels and then configures the appservice to
bridge them. It also will add these rooms to a matrix communtiy.

Why is this called Picard? He commands the bridge!",2018-04-24-picard.md,,,
opsdroid connector,opsdroid,https://github.com/opsdroid/connector-matrix,bot,,A connector for opsdroid to receive and respond to messages,Beta,,Python,Apache,,,A connector for [opsdroid](https://github.com/opsdroid/opsdroid) to receive and respond to messages,2018-04-24-opsdroid-connector.md,,,
matrix-python-sdk,,https://github.com/matrix-org/matrix-python-sdk,,,,,,,,,,,,,,
matrix-twitch-bridge,,https://github.com/Nordgedanken/matrix-twitch-bridge,,,,,,,,,,,,,,
IdleRPG,,https://github.com/FabricLabs/doorman,,,,,,,,,,,,,,
URI protocol scheme,,,,,,,,,,,,,,,,
Quaternion,QMatrixClient team,https://github.com/QMatrixClient/Quaternion,client,https://raw.githubusercontent.com/QMatrixClient/Quaternion/master/quaternion.png,A Qt5-based IM client for the Matrix protocol,Beta,,C++/Qt,GPL3,"Yes, it's kitsune",,"Quaternion is a cross-platform Qt5-based desktop IM client for Matrix, a reference desktop application using [libqmatrixclient SDK](https://matrix.org/docs/projects/sdk/libqmatrixclient.html). Source code, issue tracker, roadmap etc. can be found at [GitHub](https://github.com/QMatrixClient/Quaternion). The latest release (with links to cross-platform source code archives, as well as archived binaries for Windows) can be found at the [GitHub Releases page](https://github.com/QMatrixClient/Quaternion/releases/latest).

Most of talking around Quaternion happens in our Matrix room: [#quaternion:matrix.org](https://matrix.to/#/#quaternion:matrix.org). Welcome, and have fun!",2015-06-27-quaternion.md,https://raw.githubusercontent.com/QMatrixClient/Quaternion/master/quaternion.png,,#quaternion:matrix.org
Matrix.org AngularJS SDK,Matrix.org team,https://github.com/matrix-org/matrix-angular-sdk,sdk,,AngularJS SDK is deprecated.,No longer maintained,,JavaScript,Apache,,,"AngularJS services from Matrix.org for building communication apps in Angular based on Matrix: [https://github.com/matrix-org/matrix-angular-sdk](https://github.com/matrix-org/matrix-angular-sdk)

These are no longer being actively maintained.",2014-11-04-matrix.org-angularjs-sdk.md,,,
Dendron,Matrix.org team,https://github.com/matrix-org/dendron,server,,"Discontinued in favour of Dendrite (""Dendron, done right"")",No longer maintained,,Go,,,,"Dendron was the start of an experimental Matrix homeserver written in Go, built as a 'strangler pattern' implementation on top of Synapse.  It was discontinued in favour of Dendrite.

The code lives on at [github](https://github.com/matrix-org/dendron)!",2016-01-13-dendron.md,,,
Lightrix,Ryan Rix,,other,,Drive Adafruit Neopixels over Matrix,Beta,,,,,,"Control Adafruit Neopixels via Matrix!

Check it out from [Ryan's git repo](https://fort.kickass.systems/git/rrix/lightrix) or watch it in action on [YouTube](https://www.youtube.com/watch?v=4YG9Fk5aP24)",2016-02-03-lightrix.md,,,
mcat,Ryan Rix,,other,,Pipe to/from a Matrix room via the Python SDK,Beta,,,,,,"Pipe in to and out of a Matrix room using the [Matrix Python SDK](https://github.com/matrix-org/matrix-python-sdk).

Check it out from [Ryan's git repo](https://fort.kickass.systems/git/rrix/matrix-cat)",2016-02-03-mcat.md,,,
feedbot,Ryan Rix,,bot,,Connects to RSS and Twitter feeds,Early Beta,,,,,,"Connect to RSS and Twitter feeds via Ryan Rix's feedbot!

Check it out from [Ryan's git repo](https://fort.kickass.systems/git/rrix/matrix-feedbot)",2016-02-03-feedbot.md,,,
NEB (N. E. Bot),Kegsay,https://github.com/matrix-org/Matrix-NEB,bot,,Our dear Matrix Bot (v1),Late Beta,,Python,Apache,,,Kegsay's general-purpose Python Matrix Bot framework ([github](https://github.com/Kegsay/Matrix-NEB)),2014-09-10-neb.md,,,
Synapse,Matrix.org team,https://github.com/matrix-org/synapse/,server,https://matrix.org/blog/wp-content/uploads/2015/04/Screen-Shot-2015-04-29-at-00.28.25-400x284.png,Matrix.org homeserver,Beta,,Python,Apache,,,"Matrix.org’s reference server – Synapse: [https://github.com/matrix-org/synapse](https://github.com/matrix-org/synapse)

Apt repo: [https://matrix.org/packages/debian/](https://matrix.org/packages/debian/)

Dockerfile from Silvio Fricke and AVENTER: [https://hub.docker.com/r/avhost/docker-matrix/](https://hub.docker.com/r/avhost/docker-matrix/)

ArchLinux package from Ivan Shapovalov: [https://www.archlinux.org/packages/community/any/matrix-synapse/](https://www.archlinux.org/packages/community/any/matrix-synapse/)

There is a FreeBSD package on [freshports.org](http://www.freshports.org/net/py-matrix-synapse/).

Martin Giess has created an auto-deployment process with vagrant/ansible, tested with VirtualBox/AWS/DigitalOcean – see [https://github.com/EMnify/matrix-synapse-auto-deploy](https://github.com/EMnify/matrix-synapse-auto-deploy) for details.

Synapse is also on the [Open Build Service](https://obs.infoserver.lv/project/show/matrix-synapse).

Synapse is available for the [Nix package manager](https://github.com/NixOS/nixpkgs/blob/master/nixos/modules/services/misc/matrix-synapse.nix).

You can get Synapse on [Yunohost](https://github.com/YunoHost-Apps/synapse_ynh)

There is also a [handy spreadsheet](http://matrix.org/docs/projects/other/hdd-space-calc-for-synapse.html) to calculate HDD space for your Synapse instance.",2014-08-12-synapse.md,https://matrix.org/blog/wp-content/uploads/2015/04/Screen-Shot-2015-04-29-at-00.28.25-1080x579.png,,
node-purple,Matrix.org team / tjfontaine,https://github.com/tjfontaine/node-purple,as,,Basic FFI bindings for libpurple,Early Beta,,JavaScript,MIT,,,"[node-purple](https://github.com/tjfontaine/node-purple) provides basic FFI bindings for libpurple. In our fork, [appservice](https://github.com/matrix-org/node-purple/tree/master/appservice) connects node-purple to the AS API, so you can talk from Matrix to libpurple's connections.",2015-10-06-node-purple.md,,,
WeeChat script,Tor,https://github.com/torhve/weechat-matrix-protocol-script,client,https://matrix.org/blog/wp-content/uploads/2015/04/Screen-Shot-2015-04-22-at-21.43.01-400x284.png,"For fans of command line interfaces, a nice Matrix script for WeeChat, an IRSSI like CLI",Late Beta,,Lua,MIT,,,"[WeeChat](http://weechat.org/) is a super powerful CLI chat client that is extensible in many languages to allow for new protocols like Matrix. @torhve contributed this great WeeChat script for Matrix which is getting a good feedback from more geeky users.

To use it, you will need to sign up for a Matrix account on a server using the [Console Web](./matrix-console.html) or [Vector](./vector.html) clients, as WeeChat doesn’t support registration yet.

To run it, grab the code from [@torhve's github repo](https://github.com/torhve/weechat-matrix-protocol-script).",2015-02-26-weechat.md,https://matrix.org/blog/wp-content/uploads/2015/04/Screen-Shot-2015-04-22-at-21.43.01.png,,
Glowing Bear + WeeChat Script,glowing-bear.org,,client,https://matrix.org/blog/wp-content/uploads/2015/04/Screen-Shot-2015-04-21-at-17.36.43-400x284.png,A great IRC-style web interface to Matrix.,Late Beta,,,,,,[Glowing Bear](http://glowing-bear.org/) combined with [@torhve’s Matrix script for WeeChat](./weechat.html) makes for a great IRC-style web interface to Matrix.,2016-01-05-glowing-bear-and-weechat-plugin.md,https://matrix.org/blog/wp-content/uploads/2015/04/Screen-Shot-2015-04-21-at-17.36.43-1080x581.png,,
silvy-matrix,jaller94,https://github.com/jaller94/silvy-matrix,bot,,A personal chatbot,Beta,,JavaScript,AGPL3,,,"Silvy is a personal chatbot and most modules are specifically written for (the author.)

Her features include:

* manages / calculates TOTP 2-Factor Authentication codes,
* OpenStreetMap change notifications,
* an advent calendar,
* posting stickers (since Matrix.org doesn’t support our stickers) and
* anniversary reminder.",2018-04-24-silvy-matrix.md,,,
matrix-appservice-prosody,uhoreg,https://gitlab.com/uhoreg/matrix-appservice-prosody,as,,Prosody module to act as a Matrix Application Service,Alpha,,Lua,,,,"Prosody module to act as a Matrix Application Service.  This module allows XMPP
users to join Matrix rooms as if they were MUC rooms, unlike most Matrix
bridges that allow Matrix users to join rooms from other networks.  I did this
direction since it seemed easier, and I was mostly interested in seeing how
well the idea worked.",2018-04-24-matrix-appservice-prosody.md,,,
Trinity,Amin Husni,https://github.com/aminhusni/Trinity_Matrix_Management_GUI,other,,A management GUI for Matrix-Synapse server,Beta,,C#,AGPL3,,,"A management GUI for Matrix-Synapse server

* Get whois on user
* Deactivate an account
* Reset password
* Create new user(this is using the old API. Same API used as if you create a user via SSH terminal)
* Query rooms(publicly listed rooms only)
* Purge room
* View supported API versions",2017-11-23-Trinity.md,/docs/projects/images/trinity.png,,
Tensor,David A Roberts,https://github.com/davidar/tensor,client,https://matrix.org/blog/wp-content/uploads/2015/11/tensor1-400x284.png,QML-based Matrix client,Alpha,,C++/QML,GPL3,,,"Tensor is a cross-platform native Matrix client, based on QtQuick/QML and libqmatrixclient (previous versions used matrix-js-sdk). It has been tested on Desktop GNU/Linux, OS X, Windows, Android, SailfishOS and Ubuntu Touch. Get it from [github](https://github.com/davidar/tensor).",2015-06-26-tensor.md,https://matrix.org/blog/wp-content/uploads/2015/11/tensor1.png,,
Mage.matrix-stack,Vaizard,https://github.com/Vaizard/mage-matrix-stack,other,,Mage is a set of Ansible roles are constructed around LXD containers and Ubuntu,Beta,,,N/A,,,"Mage is a set of Ansible roles are constructed around LXD containers and Ubuntu. Mage may support other Guest-OS distros on a nice-to-have basis in the following order: Gentoo (because its cool), Debian (because its easy to migrate to), CentOS/Rhel (because Ansilbe is cool). No other distribution support is planned.

The matrix container sports the mage.matrix-stack role consisting of:

* matrix-synapse (matrix server listening on ports 8448 and 8008)
* riot-web (glossy web client / frontend to the matrix-synapse server - static webapp written in js)
* coturn (turn server listening on ports 3478, 3479)
* postgres (storage for matrix-synapse)
* nginx (serving riot-web, listening on port 80)

and expects a proxy/loadbalancer sitting infront of it (this is provided by the container below)",2018-04-24-Mage.matrix-stack.md,,,
jira-to-matrix,Mobitel Ltd,https://github.com/mobitel-ltd/jira-to-matrix,bot,,A bot which listens to JIRA Webhooks and sends stuff between Matrix and Jira.,Beta,,JavaScript,,,,"A bot (web-service) which:

* listens to JIRA Webhooks and sends some stuff to Matrix;
* use command from Matrix Riot to integrate with Jira and make different actions.

Features
+ Creates a room for every new issue;
+ Invites new participants to the room;
+ Posts any issue updates to the room;
+ Appropriately renames the room if the issue was moved to another project;
+ Post new links to related rooms. Notifies when a related issue's status changes;
+ Talks in English or Russian only (easily extendible, see `src/locales`).",2018-04-24-jira-to-matrix.md,,,
matrix-java,tavoda,https://github.com/tavoda/matrix-java,client,,A Java client for Matrix,Alpha,,Java,,,,Purpose of this project is develop Java client for Matrix server (tested agains SYNAPSE). As side effect I would like to improve matrix-doc swagger specification now available in my forked repository (https://github.com/tavoda/matrix-doc),2018-04-24-matrix-java.md,,,
evelium,Travis Ralston,https://github.com/turt2live/evelium,client,,"A matrix chat client to facilitate communication amoung communities, organizations, and individuals",Beta,https://evelium.io,TypeScript,GPL3,,,"A matrix chat client to facilitate communication amoung communities, organizations, and individuals",,,,
go-avbot,AVENTER,https://github.com/AVENTER-UG/go-avbot,bot,,"The AVENTER bot, based on go-neb",Alpha,,Go,GPL3,,,"AVBOT is our digital working partner. He is helping us with our daily business. From creating and sending out invoices to install server applications. AVBOT is based on go-neb, a matrix BOT developed in golang.",2018-04-24-go-avbot.md,,,
Nebuchadnezzar,MartijnBraam,https://github.com/MartijnBraam/Nebuchadnezzar,client,,Linux native chat client (GTK2),Alpha,,C#,,,,"Linux native chat client (GTK2) for the matrix network

Features

- [x] Logging in
- [x] Loading avatars
- [x] Receiving plain-text messages
- [x] Receiving image messages
- [ ] Receiving files
- [ ] Sending plain-text messages
- [ ] Sending images
- [ ] Sending files
- [ ] Support encrypted chatrooms",2018-04-24-Nebuchadnezzar.md,,,
synapse-appservice-docker,aidalgol,https://github.com/aidalgol/synapse-appservice-docker,other,,Docker Compose setup for development of Synapse and Matrix appservices,Beta,,Shell,,,,This is a Docker Compose setup for development of Synapse and Matrix appservices.,2018-04-24-synapse-appservice-docker.md,,,
kacki,synopia,https://github.com/synopia/kacki,client,,"Simple chatbot for matrix.org, inspired by rbot.",Alpha,,Kotlin,,,,"Simple chatbot for [matrix.org](https://matrix.org/]), inspired by [rbot](https://github.com/ruby-rbot/rbot).

Uses the matrix rest API to communicate with server, kotlin coroutines.

Project contains some experimental code using [deeplearning4j](https://github.com/deeplearning4j).",2018-04-24-kacki.md,,,
mxhsd,Max Dor,https://github.com/kamax-io/mxhsd,server,,mxhsd is Matrix Homeserver aimed towards entities who want to have in-depth control of their servers,Early Beta,,Java,,,,"mxhsd wants to provide a Matrix Homeserver implementation with the expected level of admin, control and auditing corporations would expect, where every action performed by a user can be controlled by an ACL.

mxhsd wants to be as extensible as possible, relying on a module framework, so anyone can manage every detail of its server(s).",2018-04-24-mxhsd.md,,,
matrix-docker-ansible-deploy,spantaleev,https://github.com/spantaleev/matrix-docker-ansible-deploy,other,,Matrix server setup using Ansible and Docker,Beta,,Shell,,,,"This Ansible playbook is meant to easily let you run your own [Matrix](http://matrix.org/) homeserver.

That is, it lets you join the Matrix network with your own `@<username>:<your-domain>` identifier, all hosted on your own server.

Using this playbook, you can get the following services configured on your server:

- a [Matrix Synapse](https://github.com/matrix-org/synapse) homeserver - storing your data and managing your presence in the [Matrix](http://matrix.org/) network

- (optional) [Amazon S3](https://aws.amazon.com/s3/) storage for your Matrix Synapse's content repository (`media_store`) files using [Goofys](https://github.com/kahing/goofys)

- (optional default) [PostgreSQL](https://www.postgresql.org/) database for Matrix Synapse - providing better performance than the default [SQLite](https://sqlite.org/) database. Using an external PostgreSQL server [is possible](#using-an-external-postgresql-server-optional) as well

- a [STUN/TURN server](https://github.com/coturn/coturn) for WebRTC audio/video calls

- (optional default) a [Riot](https://riot.im/) web UI, which is configured to connect to your own Matrix Synapse server by default

- free [Let's Encrypt](https://letsencrypt.org/) SSL certificate, which secures the connection to the Synapse server and the Riot web UI

- (optional default) an [nginx](http://nginx.org/) web server, listening on ports 80 and 443 - standing in front of all the other services. Using your own webserver [is possible](#using-your-own-webserver-instead-of-this-playbooks-nginx-proxy-optional)

Basically, this playbook aims to get you up-and-running with all the basic necessities around Matrix, without you having to do anything else.",2018-04-24-matrix-docker-ansible-deploy.md,,,
xonotic,TimePath,https://gitlab.com/xonotic,client,,In-game chat,Beta,,,,,,,2018-04-24-xonotic.md,,,
matrix-olm-cpp,ajberchek,https://github.com/ajberchek/matrix-olm-cpp,other,,"Provides a C++ wrapper for the libolm library, used in Matrix's end-to-end encryption",Beta,,C++,,,,"This repo provides a C++ wrapper for the library, [libolm](https://git.matrix.org/git/olm/), used in Matrix's end-to-end encryption.",2018-04-24-matrix-olm-cpp.md,,,
matrixmon,leonerd,https://github.com/matrix-org/matrixmon,other,,A small end-to-end prober and Prometheus stats exporter for a Matrix homeserver,Beta,,Perl,,,,A small end-to-end prober and Prometheus stats exporter for a Matrix homeserver,2018-04-24-matrixmon.md,,,
matrix-redux-wrap,Luke Barnard,https://github.com/lukebarnard1/matrix-redux-wrap,sdk,,A library that exposes matrix-js-sdk state via Redux,Stable,,JavaScript,Apache,,,Matrix Redux Wrap was motivated by the need to expose the Matrix protocol via a Redux store. The matrix-js-sdk API does not expose a Redux-like pattern through which data flows but rather a number of asyncronous HTTP-request wrappers and a number of models that encapsulate the objects within the Matrix protocol. These models are updated by a mixture of server responses and API calls and do not necessarily lend themselves to simple mental models or the ability to be incorporated into frameworks such as Flux and Redux.,2018-04-24-matrix-redux-wrap.md,,,
palaver,MrCustomizer,https://github.com/MrCustomizer/palaver,client,,Palaver is a chat client for Matrix written in Kotlin.,Alpha,,Kotlin,GPL3,,,"Palaver is a chat client for Matrix written in Kotlin.

The project is currently in early Alpha status. Basic chatting is possible, but a lot of important features are missing.",2018-04-24-palaver.md,,,
matrix-client-legacy-el,jgkamat,https://github.com/jgkamat/matrix-client-legacy-el,client,,An attempt to maintain the legacy matrix-client.el a little bit longer,Alpha,,Lisp,GPL3,,,"This is a fork of the [[https://home.rix.si/git/rrix/matrix-client][original matrix.el client]], to attempt to resurrect it.",2018-04-24-matrix-client-legacy-el.md,,,
matrix-synapse-docker,ananace,https://github.com/ananace/matrix-synapse,other,,The Matrix Synapse homeserver for Docker / k8s,Beta,,Shell,,,,The Matrix Synapse homeserver for Docker / k8s,2018-04-24-matrix-synapse-docker.md,,,
Operator,uhoreg,https://vcs.uhoreg.ca/git/cgit/operator/,sdk,,Operator is a C++ library for plugging into the Matrix,Alpha,,C++,Apache,,,Operator is a C++ library for plugging into the Matrix,2018-04-24-Operator.md,,,
Matriksi,sailbook,https://github.com/DylanVanAssche/harbour-matriksi,client,,Matriksi is a client for Sailfish OS,Beta,https://openrepos.net/content/sailbook/matriksi,Python,GPL3,,,Matriksi is a client for Sailfish OS,2018-04-24-Matriksi.md,,,
mini-vector-android,LiMium,https://github.com/LiMium/mini-vector-android,client,,"A simpler Matrix client for Android, with fewer permissions and dependencies",Beta,,Java,Apache,,,"This is a minified Android Matrix client derived from the official client. It requires fewer permissions and compiles to a much smaller package.

Full credit goes to the original developers. This fork just shaves-off the following features and dependencies:
   * Jitsi integration (for audio / video conference)
   * React native libraries
   * Application Icon badger
   * Analytics

 
Links
* [PlayStore](https://play.google.com/store/apps/details?id=com.lavadip.miniVector)
* FDroid build, coming soon. Issue [#3](https://github.com/LiMium/mini-vector-android/issues/3)
* Matrix chat room: [#miniVectorAndroid:matrix.org](https://matrix.to/#/#miniVectorAndroid:matrix.org)",2018-04-24-mini-vector-android.md,,,
matrique,b0,https://gitlab.com/b0/matrique,client,,"A glossy client for Matrix, written in QtQuick Controls 2 and C++",Alpha,,C++,GPL3,,,"A glossy client for Matrix, written in QtQuick Controls 2 and C++",2018-04-24-matrique.md,,,
matrixstats.org,a13xmt,https://github.com/a13xmt/matrixstats.org,other,,"The first public catalog for matrix rooms, grouped by ratings or categories",Beta,https://matrixstats.org,Python,,,,"The first public catalog for matrix rooms, grouped by ratings or categories",2018-04-24-matrixstats.org.md,,,
